"";"2431";"243102 - Juruanalisis Penyelidikan Pasaran Perniagaan"
"";"2431";"243103 - Pegawai Promosi Jualan"
"";"2431";"243104 - Pegawai Kecekapan Perniagaan"
"";"2432";"KUMPULAN UNIT 2432 PROFESIONAL PERHUBUNGAN AWAM"
"";"2432";"Profesional Perhubungan Awam menambah baik memberi nasihat dan mengaplikasikan"
"";"2432";"kaedah operasi untuk membina memelihara dan menguruskan komunikasi antara organisasi"
"";"2432";"dengan khalayaknya."
"";"2432";"Tugas merangkumi"
"";"2432";"a) bertanggungjawab menguruskan sidang akhbar draf kenyataan akhbar nota-nota taklimat dan"
"";"2432";"maklumat pengurusan penerbitan pameran dan laporan tahunan"
"";"2432";"b) menulis dan menyunting siaran akhbar berita dalaman ucapan rencana dan laporan tahunan"
"";"2432";"c) menyimpan dan mengemas kini maklumat tentang laman web organisasi"
"";"2432";"d) menyediakan dan menyelia pengeluaran brosur publisiti edaran video promosi fotograf filem dan"
"";"2432";"program multimedia"
"";"2432";"e) menjawab pertanyaan daripada individu wartawan dan organisasi lain"
"";"2432";"f) memberi taklimat ketika pembentangan sidang akhbar temu ramah radio dan televisyen dan sesi"
"";"2432";mesyuarat
"";"2432";"g) membangunkan dan mengekalkan hubungan kerja yang baik dengan pihak media termasuk akhbar"
"";"2432";"tempatan dan nasional majalah radio dan televisyen"
"";"2432";"h) mengatur acara khas seperti sidang akhbar pameran hari terbuka lawatan pertandingan dan"
"";"2432";penajaan
"";"2432";"i) memupuk hubungan komuniti melalui acara seperti hari terbuka dan melalui penglibatan masyarakat"
"";"2432";"j) menumpukan pada peningkatan kesejahteraan individu keluarga dan masyarakat"
"";"2432";"k) merancang penyelidikan dan penilaian"
"";"2432";"l) menjalankan tugas yang berkaitan dan"
"";"2432";"m) meningkatkan kefahaman serta menyelaras pelaksanaan kerja."
"";"2432";"Contoh pekerjaan yang dikelaskan di sini (rujuk indeks kumpulan unit 2432)"
"";"2432";"243201 - Pegawai Penerangan Gred S41"
"";"2432";"243202 - Pegawai Perhubungan Awam"
"";"2432";"243203 - Eksekutif Hal Ehwal Korporat"
"";"2432";"243204 - Eksekutif Perhubungan Perindustrian"
"";"2433";"KUMPULAN UNIT 2433 PROFESIONAL JUALAN TEKNIKAL DAN PERUBATAN"
"";"2433";"(TIDAK TERMASUK ICT)"
"";"2433";"Profesional Jualan Teknikal dan Perubatan (Tidak Termasuk ICT) menambah baik"
"";"2433";"menasihat atau mengaplikasikan kaedah operasi khusus dalam penjualan produk perubatan"
"";"2433";"dan penjagaan kesihatan termasuk pemasangan kelengkapan dan produk teknikal dan"
"";"2433";"menyediakan maklumat khusus seperti yang diperlukan."
"";"2433";"Tugas merangkumi"
"";"2433";"a) menilai keperluan dan mengesyorkan barangan atau perkhidmatan yang sesuai"
"";"2433";"b) menghadiri mesyuarat syarikat sesi penerangan dan taklimat data teknikal"
"";"2433";"c) peka tentang perkembangan Perkhidmatan Kesihatan Kebangsaan (NHS) menjangka impak negatif"
"";"2433";"dan positif yang mungkin timbul ke atas perniagaan dan mengamalkan strategi sewajarnya"
"";"2433";"d) peka tentang aktiviti perkhidmatan kesihatan di kawasan tertentu"
"";"2433";"e) menyediakan maklumat mengenai reka bentuk di mana produk atau perkhidmatan hendaklah"
"";"2433";"mengikut keperluan pelanggan"
"";"2433";"f) membuat laporan dan kertas kerja untuk menjalankan demonstrasi mengenai faedah produk atau"
"";"2433";"perkhidmatan tersebut"
"";"2433";"g) mengatur penghantaran barangan pemasangan peralatan dan penyediaan perkhidmatan"
"";"2433";"h) merancang membuat penyelidikan dan penilaian"
"";"2433";"i) menjalankan tugas yang berkaitan dan"
"";"2433";"j) meningkatkan kefahaman dan menyelaras pelaksanaan kerja."
"";"2433";"Contoh pekerjaan yang dikelaskan di sini (rujuk indeks kumpulan unit 2433)"
"";"2433";"243301 - Wakil Jualan Perubatan"
"";"2433";"243302 - Wakil Jualan Peralatan Perubatan"
"";"2433";"243303 - Wakil Jualan Perkakasan Perubatan"
"";"2433";"243304 - Wakil Jualan Peralatan Aktif Implan"
"";"2434";"KUMPULAN UNIT 2434 PROFESIONAL JUALAN TEKNOLOGI MAKLUMAT DAN KOMUNIKASI"
"";"2434";(ICT)
"";"2434";"Profesional Jualan Teknologi Maklumat dan Komunikasi (ICT) menjual pelbagai perkakasan"
"";"2434";"komputer perisian serta barangan dan perkhidmatan teknologi maklumat dan komunikasi"
"";"2434";"lain termasuk pemasangan dan menyediakan maklumat khusus menurut keperluan."
"";"2434";"Tugas merangkumi"
"";"2434";"a) mendapatkan pesanan dan menjual barangan kepada pertubuhan runcit industri borong dan"
"";"2434";"pertubuhan lain"
"";"2434";"b) menjual kelengkapan bekalan dan perkhidmatan teknikal kepada pertubuhan perniagaan atau"
"";"2434";individu
"";"2434";"c) membincangkan keperluan pelanggan baru dan sedia ada dan menyediakan maklumat khusus"
"";"2434";"tentang bagaimana kelengkapan bekalan dan perkhidmatan tertentu memenuhi keperluan tersebut"
"";"2434";"d) menyebut dan merundingkan harga syarat kredit mengikat kontrak dan merekodkan pesanan"
"";"2434";"e) mengemas kini rekod pelanggan dan menyediakan laporan jualan"
"";"2434";"f) mengatur penghantaran barangan pemasangan kelengkapan dan penyediaan perkhidmatan dan"
"";"2434";"g) melaporkan reaksi dan keperluan pelanggan kepada pengilang."
"";"2434";"Contoh pekerjaan yang dikelaskan di sini (rujuk indeks kumpulan unit 2434)"
"";"2434";"243401 - Wakil Jualan Teknologi Maklumat dan Komunikasi"
"";"2434";"243402 - Wakil Jualan Komputer"
"";"2434";"243403 - Jurutera Sokongan Produk"
"";"2434";"243404 - Jurutera Jualan Teknologi Maklumat"
"";"2434";"SUB-UTAMA 25 PROFESIONAL TEKNOLOGI MAKLUMAT DAN KOMUNIKASI"
"";"2434";"Profesional Teknologi Maklumat dan Komunikasi menjalankan penyelidikan merancang mereka bentuk"
"";"2434";"menulis menguji memberi nasihat dan menambah baik sistem perkakasan perisian dan konsep yang"
"";"2434";"berkaitan dengan teknologi maklumat untuk aplikasi khusus membangunkan dokumentasi berkaitan"
"";"2434";"termasuk prinsip dasar dan prosedur dan mereka bentuk membangunkan mengawal menyelenggara"
"";"2434";"dan menyokong pangkalan data dan sistem maklumat lain untuk memastikan prestasi integriti dan"
"";"2434";"keselamatan data yang optimum."
"";"2434";"Pekerjaan dalam kumpulan sub-utama ini diklasifikasikan kepada kumpulan kecil berikut"
"";"2434";"251 PEMBANGUN DAN JURUANALISIS PERISIAN DAN APLIKASI"
"";"2434";"252 PROFESIONAL PANGKALAN DATA DAN RANGKAIAN"
"";"2434";"253 PROFESIONAL KESELAMATAN TEKNOLOGI MAKLUMAT"
"";"2434";"254 PROFESIONAL KANDUNGAN KREATIF DAN DIGITAL"
"";"2434";"KUMPULAN KECIL 251 PEMBANGUN DAN JURUANALISIS PERISIAN DAN APLIKASI"
"";"2434";"Pembangun dan Juruanalisis Perisian dan Aplikasi menjalankan penyelidikan merancang mereka bentuk"
"";"2434";"menulis menguji memberi nasihat dan menambah baik sistem teknologi maklumat seperti perkakasan"
"";"2434";"perisian dan aplikasi lain untuk memenuhi keperluan khusus."
"";"2434";"Pekerjaan dalam kumpulan kecil ini diklasifikasikan kepada kumpulan unit berikut"
"";"2434";"2511 JURUANALISIS SISTEM KOMPUTER"
"";"2434";"2512 PEMBANGUN PERISIAN"
"";"2434";"2513 PEMBANGUN WEB DAN MULTIMEDIA"
"";"2434";"2514 PENGATURCARA APLIKASI"
"";"2434";"2519 PEMBANGUN DAN JURUANALISIS PERISIAN DAN APLIKASI YANG TIDAK DIKELASKAN"
"";"2434";"DI MANA-MANA"
"";"2511";"KUMPULAN UNIT 2511 JURUANALISIS SISTEM KOMPUTER"
"";"2511";"Juruanalisis Sistem Komputer berperanan untuk mengumpul dan menganalisis fakta"
"";"2511";"tentang operasi prosedur dan sistem bagi memindahkannya kepada bentuk program yang"
"";"2511";"sesuai untuk peralatan pemprosesan data dan mencadangkan penggunaan komputer bagi"
"";"2511";"meningkatkan kecekapan produktiviti dan keuntungan organisasi."
"";"2511";"Tugas merangkumi"
"";"2511";"a) menyediakan spesifikasi program untuk tindakan Pengaturcara Komputer"
"";"2511";"b) menjalankan penyelidikan menganalisis dan menilai keperluan teknologi maklumat prosedur atau"
"";"2511";"masalah pelanggan"
"";"2511";"c) membangun melaksanakan cadangan dan rancangan untuk meningkatkan sistem maklumat"
"";"2511";"semasa atau akan datang"
"";"2511";"d) mengenalpasti menilai ketidakcekapan dan menganalisis proses prosedur serta amalan kerja untuk"
"";"2511";"mengoptimumkan prestasi organisasi"
"";"2511";"e) mencipta mengambil dan melaksanakan projek pengujian sistem"
"";"2511";"f) membangunkan spesifikasi fungsi untuk kegunaan pemaju sistem"
"";"2511";"g) memperluaskan atau meminda sistem bagi meningkatkan aliran kerja untuk perkhidmatan baru"
"";"2511";"h) mengkoordinasi dan menghubungkan sistem-sistem komputer antara organisasi untuk"
"";"2511";"mengoptimumkan operasi organisasi"
"";"2511";"i) menjalankan tugas yang berkaitan dan"
"";"2511";"j) meningkatkan kefahaman dan menyelaras pelaksanaan kerja."
"";"2511";"Contoh pekerjaan yang dikelaskan di sini (rujuk indeks kumpulan unit 2511)"
"";"2511";"251101 - Juruanalisis Sistem Maklumat Pengurusan (MIS)"
"";"2511";"251102 - Juruanalisis Sistem Komputer"
"";"2511";"251103 - Perunding Komputer"
"";"2511";"251104 - Perunding Sistem Teknologi Maklumat"
"";"2512";"KUMPULAN UNIT 2512 PEMBANGUN PERISIAN"
"";"2512";"Pembangun Perisian menyelidik menganalisis dan menilai keperluan aplikasi perisian dan"
"";"2512";"sistem operasi sedia ada atau yang baharu dan mereka bentuk membangunkan menguji dan"
"";"2512";"menyelesaikan masalah perisian untuk memenuhi keperluan yang ditetapkan."
"";"2512";"Tugas merangkumi"
"";"2512";"a) menyelidik menganalisis dan menilai keperluan aplikasi perisian dan sistem operasi"
"";"2512";"b) menyelidik mereka bentuk dan membangunkan sistem perisian komputer"
"";"2512";"c) merujuk kakitangan kejuruteraan untuk menilai antara muka (interface) antara perkakasan dengan perisian"
"";"2512";"d) membangun dan mengarahkan pengujian perisian dan pengesahan prosedur"
"";"2512";"e) mengubahsuai perisian sedia ada untuk membetulkan ralat dan menyesuaikannya dengan"
"";"2512";"perkakasan baru atau untuk menaik taraf antara muka (interface) dan meningkatkan prestasi"
"";"2512";"f) mengarah pengaturcaraan perisian dan pembangunan dokumentasi"
"";"2512";"g) menilai membangunkan menaik taraf dan mendokumentasi prosedur penyelenggaraan untuk"
"";"2512";"sistem operasi persekitaran komunikasi dan perisian aplikasi"
"";"2512";"h) merujuk pelanggan berhubung dengan penyelenggaraan sistem perisian dan"
"";"2512";"i) meningkatkan kefahaman dan menyelaras pelaksanaan kerja."
"";"2512";"Contoh pekerjaan yang dikelaskan di sini rujuk indeks kum pulan unit 2512)"
"";"2512";"251201 - Pembangun Perisian"
"";"2512";"251202 - Pembangun Perisian Multimedia"
"";"2512";"251203 - Pereka Perisian"
"";"2512";"251204 - Jurutera Rekabentuk"
"";"2513";"KUMPULAN UNIT 2513 PEMBANGUN WEB DAN MULTIMEDIA"
"";"2513";"Pembangun Web dan Multimedia menggabungkan pengetahuan reka bentuk dan teknikal"
"";"2513";"untuk menyelidik menganalisis menilai mereka bentuk mengatur cara dan mengubahsuai"
"";"2513";"laman web dan aplikasi yang memaparkan teks grafik animasi pengimejan audio dan video"
"";"2513";"dan media interaktif lain."
"";"2513";"Tugas merangkumi"
"";"2513";"a) menganalisis mereka bentuk dan membangunkan laman Internet dengan menggunakan hasil seni"
"";"2512";"dan kreativiti dengan menggunakan pengaturcaraan perisian (software programming) dan bahasa"
"";"2513";"penskripan (scripting languages) dan antara muka (interfacing) dengan persekitaran operasi"
"";"2512";"b) mereka bentuk dan membangunkan animasi digital pengimejan persembahan permainan audio"
"";"2512";"dan klip video dan aplikasi Internet dengan menggunakan perisian multimedia perkakasan dan"
"";"2512";"utiliti grafik interaktif dan bahasa pengaturcaraan"
"";"2513";"c) berhubung dengan pakar rangkaian berkenaan dengan isu yang berkaitan dengan web seperti"
"";"2512";"keselamatan dan hosting laman web untuk mengawal dan menguatkuasakan keselamatan Internet"
"";"2512";"dan pelayan web (web server) peruntukan ruang (space allocation) akses pengguna laman web"
"";"2512";"sandaran (website backup) dan perancangan pemulihan bencana"
"";"2513";"d) mereka bentuk membangunkan dan menyepadukan kod komputer dengan input khusus lain seperti"
"";"2512";"fail imej fail audio dan penskripan bahasa untuk menghasilkan menyelenggara dan menyokong"
"";"2512";"laman web"
"";"2513";"e) membantu menganalisis menetapkan dan membangunkan strategi Internet (Internet strategies)"
"";"2512";"metodologi pangkalan web (web-based methodologies) dan pelan pembangunan (development plans)"
"";"2513";"f) menjalankan tugas yang berkaitan dan"
"";"2513";"g) meningkatkan kefahaman dan menyelaras pelaksanaan kerja."
"";"2513";"Contoh pekerjaan yang dikelaskan di sini (rujuk indeks kumpulan unit 2513)"
"";"2513";"251301 - Pembangun Laman Web"
"";"2513";"251302 - Pembangun Internet Intranet"
"";"2513";"251303 - Arkitek Laman Web"
"";"2513";"251304 - Pengendali Web"
"";"2514";"KUMPULAN UNIT 2514 PENGATURCARA APLIKASI"
"";"2514";"Pengaturcara Aplikasi menulis dan menjaga program m able code yang digariskan dalam panduan"
"";"2514";" dan spesifikasi teknikal untuk aplikasi perisian dan sistem operasi"
"";"2514";"Tugas merangkumi"
"";"2514";"a) menulis dan menjaga code outline yang digariskan dalam panduan dan spesifikasi menurut standard akreditasi kualiti"
"";"2514";"b) menyemak membaik pulih atau mengembangkan program sedia ada untuk meningkatkan kecekapan operasi atau menyesuaikannya dengan keperluan baharu"
"";"2514";"c) menjalankan percubaan runs dan aplikasi perisian untuk mengesahkan ia akan menghasilkan maklumat yang dikehendaki"
"";"2514";"d) menyusun dan menulis dokumentasi pembangunan atur cara"
"";"2514";"e) mengenal pasti dan membincangkan masalah teknikal proses dan penyelesaian"
"";"2514";"f) menjalankan tugas yang berkaitan dan"
"";"2514";"g) meningkatkan kefahaman dan menyelaras pelaksanaan kerja."
"";"2514";"Contoh pekerjaan yang dikelaskan di sini (rujuk indeks kumpulan unit 2514)"
"";"2514";"251401 - Pengaturcara Komputer"
"";"2514";"251402 - Pengaturcara Perisian"
"";"2514";"251403 - Pengaturcara Teknikal"
"";"2514";"251404 - Pengaturcara Teknologi Maklumat"
"";"2519";"KUMPULAN UNIT 2519 PEMBANGUN DAN JURUANALISIS PERISIAN DAN APLIKASI YANG TIDAK DIKELASKAN DI MANA-MANA"
"";"2519";"Kumpulan unit ini merangkumi Pembangun dan Juruanalisis Perisian dan Aplikasi yang"
"";"2519";"Tidak dikelaskan di Mana-mana dalam Kumpulan Kecil 251 Pembangun dan Juruanalisis"
"";"2519";"Perisian dan Aplikasi. Sebagai contoh kumpulan ini termasuk penguji perisian penguji sistem"
"";"2519";"dan jurutera jaminan kualiti."
"";"2519";"Tugas merangkumi"
"";"2519";"a) membangunkan dan mendokumentasikan rancangan pengujian perisian"
"";"2519";"b) memasang perisian perkakasan dan mengatur perisian sistem operasi bagi persediaan pengujian"
"";"2519";"c) mengesahkan bahawa fungsi atur cara adalah mengikut keperluan pengguna dan garis panduan"
"";"2519";"yang ditetapkan"
"";"2519";"d) melaksanakan menganalisis dan mendokumentasikan keputusan pengujian aplikasi perisian serta"
"";"2519";"ujian sistem maklumat dan telekomunikasi"
"";"2519";"e) membangun dan melaksanakan pengujian perisian dan sistem maklumat dasar prosedur dan skrip"
"";"2519";"ujian perisian dan sistem maklumat"
"";"2519";"f) menjalankan tugas yang berkaitan dan"
"";"2519";"g) meningkatkan kefahaman dan menyelaras pelaksanaan kerja."
"";"2519";"Contoh pekerjaan yang dikelaskan di sini (rujuk indeks kumpulan unit 2519)"
"";"2519";"251901 - Penguji Perisian"
"";"2519";"251902 - Penguji Sistem"
"";"2519";"251903 - Jurutera Jaminan Kualiti Produk (Teknologi Maklumat)"
"";"2519";"251904 - Juruanalisis Jaminan Kualiti (Teknologi Maklumat)"
"";"252X";"KUMPULAN KECIL 252 PROFESIONAL PANGKALAN DATA DAN RANGKAIAN"
"";"252X";"Profesional Pangkalan Data dan Rangkaian mereka bentuk membangunkan menyelenggara dan membantu"
"";"252X";"mencapai prestasi optimum serta mengawal keselamatan dan infrastruktur termasuk pangkalan data"
"";"252X";"perkakasan dan perisian serta sistem rangkaian dan operasi."
"";"252X";"Pekerjaan dalam kumpulan kecil ini diklasifikasikan kepada kumpulan unit berikut"
"";"252X";"2521 PEREKA DAN PENTADBIR PANGKALAN DATA"
"";"252X";"2522 PENTADBIR SISTEM TEKNOLOGI MAKLUMAT"
"";"252X";"2523 PROFESIONAL RANGKAIAN KOMPUTER"
"";"252X";"2524 PROFESIONAL DATA"
"";"2521";"KUMPULAN UNIT 2521 PEREKA DAN PENTADBIR PANGKALAN DATA"
"";"2521";"Pereka dan Pentadbir Pangkalan Data mereka bentuk membangunkan mengawal"
"";"2521";"menyelenggara dan membantu mencapai prestasi optimum dan mengawal keselamatan"
"";"2521";"pangkalan data."
"";"2521";"Tugas merangkumi"
"";"2521";"a) mereka bentuk dan membangunkan seni bina dan struktur pangkalan data projek sistem maklumat"
"";"2521";"b) mereka bentuk membina mengubahsuai menyepadu melaksana dan menguji sistem pengurusan"
"";"2521";"pangkalan data"
"";"2521";"c) menjalankan penyelidikan dan memberi nasihat tentang pemilihan aplikasi dan pelaksanaan alat"
"";"2521";"pengurusan pangkalan data"
"";"2521";"d) membangunkan dan melaksanakan dasar dokumentasi standard dan model pentadbiran data"
"";"2521";"e) membangunkan dasar dan prosedur akses pangkalan data untuk sandaran dan pemulihan data"
"";"2521";"e) menjalankan operasi dan penyelenggaraan pencegahan untuk sandaran dan pemulihan dan"
"";"2521";"menguatkuasakan kawalan keselamatan dan integriti"
"";"2521";"f) menjalankan tugas yang berkaitan dan"
"";"2521";"g) meningkatkan kefahaman dan menyelaras pelaksanaan kerja."
"";"2521";"Contoh pekerjaan yang dikelaskan di sini (rujuk indeks kumpulan unit 2521)"
"";"2521";"252101 - Arkitek Pangkalan Data"
"";"2521";"252102 - Juruanalisis Pangkalan Data"
"";"2521";"252103 - Pentadbir Pangkalan Data"
"";"2521";"252104 - Pereka Pangkalan Data"
"";"2522";"KUMPULAN UNIT 2522 PENTADBIR SISTEM TEKNOLOGI MAKLUMAT"
"";"2522";"Pentadbir Sistem Teknologi Maklumat membangunkan menyelenggara dan membantu"
"";"2522";"mencapai prestasi optimum dan mengawal keselamatan sistem teknologi maklumat."
"";"2522";"Tugas merangkumi"
"";"2522";"a) menyelenggara dan mentadbir rangkaian komputer dan persekitaran pengkomputeran yang"
"";"2522";"berkaitan termasuk perkakasan komputer perisian sistem perisian aplikasi dan semua konfigurasi"
"";"2522";"b) mencadangkan perubahan untuk memperbaiki sistem dan konfigurasi rangkaian dan menentukan"
"";"2522";"perkakasan atau keperluan perisian yang berkaitan dengan perubahan tersebut"
"";"2522";"c) mendiagnosis masalah perkakasan dan perisian melaksanakan sandaran data (backup data) dan operasi"
"";"2522";"pemulihan bencana"
"";"2522";"d) mengendalikan induk konsol untuk memantau prestasi sistem komputer dan rangkaian dan menyelaras"
"";"2522";"akses rangkaian dan penggunaan komputer."
"";"2522";"e) menjalankan tugas yang berkaitan dan"
"";"2522";"f) meningkatkan kefahaman dan menyelaras pelaksanaan kerja."
"";"2522";"Contoh pekerjaan yang dikelaskan di sini (rujuk indeks kumpulan unit 2522)"
"";"2522";"252201 - Pegawai Teknologi Maklumat Gred F41"
"";"2522";"252202 - Pegawai Eksekutif (Teknologi Maklumat) Gred 41"
"";"2522";"252203 - Pegawai Eksekutif (Teknologi Maklumat) Gred 9"
"";"2522";"252204 - Pegawai Eksekutif (Teknologi Maklumat) Gred L5"
"";"2523";"KUMPULAN UNIT 2523 PROFESIONAL RANGKAIAN KOMPUTER"
"";"2523";"Profesional Rangkaian Komputer menyelidik menganalisis dan mencadangkan strategi"
"";"2523";"dalam seni bina rangkaian (network architecture) dan pembangunan rangkaian. Mereka"
"";"2523";"melaksanakan mengurus menyelenggara dan melakukan konfigurasi perkakasan rangkaian"
"";"2523";"dan perisian dan memantau menyelesaikan masalah dan mengoptimumkan prestasi."
"";"2523";"Tugas merangkumi"
"";"2523";"a) menganalisis membangun mentafsir dan menilai reka bentuk sistem yang kompleks dan spesifikasi"
"";"2523";"seni bina model data dan rajah dalam konfigurasi pembangunan dan integrasi sistem komputer"
"";"2523";"b) menyelidik menganalisis menilai dan memantau infrastruktur rangkaian untuk memastikan"
"";"2523";"rangkaian dikonfigurasi untuk beroperasi pada prestasi optimum"
"";"2523";"c) menilai dan mencadangkan penambahbaikan kepada operasi rangkaian dan perkakasan perisian"
"";"2523";"komunikasi dan sistem operasi bersepadu"
"";"2523";"d) menyediakan kemahiran pakar dalam menyokong dan menyelesaikan masalah rangkaian dan"
"";"2523";kecemasan
"";"2523";"e) memasang mengkonfigurasi menguji menyenggara dan mentadbir rangkaian baru dan yang dinaik"
"";"2523";"taraf aplikasi pangkalan data perisian pelayan (server) dan stesen kerja"
"";"2523";"f) menyediakan pengaturcaraan rangkaian dalam menyokong keperluan perniagaan dan keperluan"
"";"2523";khusus
"";"2523";"g) menyediakan dan mengekalkan prosedur dan dokumentasi untuk inventori rangkaian dan merakam"
"";"2523";"diagnosis dan resolusi kerosakan rangkaian peningkatan dan pengubahsuaian kepada rangkaian"
"";"2523";"dan arahan penyelenggaraan"
"";"2523";"h) menjalankan tugas yang berkaitan dan"
"";"2523";"i) meningkatkan kefahaman dan menyelaras pelaksanaan kerja."
"";"2523";"Contoh pekerjaan yang dikelaskan di sini (rujuk indeks kumpulan unit 2523)"
"";"2523";"252301 - Juruanalisis Rangkaian"
"";"2523";"252302 - Perunding Perkhidmatan Rangkaian"
"";"2523";"252303 - Pentadbir Rangkaian"
"";"2523";"252304 - Pentadbir Rangkaian Infrastruktur"
"";"2524";"KUMPULAN UNIT 2524 PROFESIONAL DATA"
"";"2524";"Profesional Data mengkhusus dalam bidang sains data yang menyediakan maklumat penting"
"";"2524";"berdasarkan sejumlah data yang kompleks atau data besar. Ia menggabungkan pelbagai bidang"
"";"2524";"kerja dalam statistik dan pengiraan untuk mentafsir data bagi tujuan membuat keputusan."
"";"2524";"Tugas merangkumi"
"";"2524";"a) menyediakan dokumen untuk menggariskan sumber data model dan algoritma yang digunakan dan dibangunkan"
"";"2524";"b) mengekstrak data dari sumber data"
"";"2524";"c) mencadangkan kegunaan baru untuk sumber dan struktur data sedia ada"
"";"2524";"d) menggabungkan pelbagai set data untuk membina set data besar dan kompleks"
"";"2524";"e) membina perisian untuk membersih menggabung dan mengurus data"
"";"2524";"f) membuat teknik pengekstrakan data untuk menyiasat petunjuk mengenal pasti corak dan"
"";"2524";"keteraturan dalam data"
"";"2524";"g) melaksanakan proses automatik untuk menghasilkan model skala"
"";"2524";"h) membangunkan kod kompleks skrip dan saluran data untuk memproses data berstruktur dan tidak berstruktur:
"";"2524";"j) menguji konfigurasi sistem data untuk meningkatkan kecekapan"
"";"2524";"k) menjalankan pencarian visualisasi data dan fungsi analisis lanjutan
"";"2524";"l) memantau prestasi sistem data"
"";"2524";"m) memudahkan pembersihan dan pengayaan data dan"
"";"2524";"n) melakukan pemeriksaan data dan semakan kawalan kualiti"
"";"2524";"Contoh pekerjaan yang dikelaskan di sini(rujuk indeks kumpulan unit 2524)"
"";"2524";2524-01 - Ahli Sains Data"
"";"2524";2524-02 - Jurutera Data Besar"
"";"2524";2524-03 - Juruanalisis Data"
"";"2524";2524-04 - Data Model"
"";"253X";"KUMPULAN KECIL 253 PROFESIONAL KESELAMATAN TEKNOLOGI MAKLUMAT"
"";"253X";"Profesional Keselamatan Teknologi Maklumat menilai dan menangani risiko keselamatan untuk dan dalam"
"";"253X";"parameter organisasi. Pekerjaan dalam kumpulan kecil ini diklasifikasikan kepada kumpulan unit berikut"
"";"253X";"2531 PROFESIONAL KESELAMATAN SIBER"
"";"2531";"KUMPULAN UNIT 2531 PROFESIONAL KESELAMATAN SIBER"
"";"2531";"Profesional Keselamatan Siber termasuk bukan sahaja fokus terhadap staf teknikal tetapi juga"
"";"2531";"mereka yang menggunakan pengetahuan mengenai keselamatan siber bagi organisasi untuk"
"";"2531";"melaksanakan misi dengan jayanya. Tenaga kerja keselamatan siber yang berpengetahuan"
"";"2531";"dan mahir diperlukan untuk menangani risiko keselamatan siber dalam keseluruhan proses"
"";"2531";"pengurusan risiko organisasi."
"";"2523";"Tugas merangkumi:"
"";"2531";"a) merancang konsep, mereka bentuk, memperoleh, dan / atau membina sistem teknologi maklumat
(IT)"";"2531";"yang selamat, dan bertanggungjawab untuk aspek pembangunan sistem dan / atau rangkaian"
"";"2531";"b) memberikan sokongan, pentadbiran, dan penyelenggaraan yang diperlukan untuk memastikan"
"";"2531";"prestasi dan keselamatan sistem teknologi maklumat (IT) yang berkesan dan efisien"
"";"2531";"c) memimpin, mengurus, memberi arahan, atau membangunkan dan memberi nasihat supaya"
"";"2531";"organisasi dapat menjalankan kerja keselamatan siber dengan berkesan"
"";"2531";"d) mengenal pasti, menganalisis, dan mengurangkan ancaman terhadap sistem dan / atau rangkaian"
"";"2531";"teknologi maklumat dalaman (IT)"
"";"2531";"e) melakukan tinjauan dan penilaian maklumat keselamatan siber yang sangat khusus untuk"
"";"2531";"menentukan kegunaannya untuk kepintaran"
"";"2531";"f) menyediakan operasi penolakan dan penipuan khusus dan pengumpulan maklumat keselamatan"
"";"2531";"siber yang mungkin digunakan utuk membangunkan kepintaran dan"
"";"2531";"g) menyiasat kejadian keselamatan siber atau jenayah yang berkaitan dengan sistem, rangkaian, dan"
"";"2531";"bukti digital teknologi maklumat (IT)"
"";"2531";"Contoh pekerjaan yang dikelaskan di sini (rujuk indeks kumpulan unit 2531)"
"";"2531";"253101 - Eksekutif keselamatan teknologi maklumat dan komunikasi"
"";"2531";"253102 - Eksekutif keselamatan siber"
"";"2531";"253103 - Pakar forensik digital"
"";"2531";"253104 - Pakar keselamatan (Teknologi Maklumat)"
"";"254X";KUMPULAN KECIL 254 PROFESIONAL KANDUNGAN KREATIF DAN DIGITAL"
"";"254X";"Profesional Kandungan Kreatif dan Digital"
"";"254X";"memberi gambaran merancang membuat menghasilkan dan"
"";"254X";"membangunkan kandungan digital menerusi pelbagai medium penghantaran seperti animasi permainan"
"";"254X";"kesan visual media baru,Virtual Reality (VR) Augmented Reality (AR)"
"";"254X";"dan format media digital yang lain."
"";"254X";"Pekerjaan dalam kumpulan kecil ini diklasifikasikan kepada kumpulan unit berikut"
"";"254X";"2541 PROFESIONAL KESAN VISUAL DAN ANIMASI"
"";"254X";"2542 PROFESIONAL PERMAINAN DIGITAL DAN E-SUKAN"
"";"254X";"2543 PROFESIONAL PEREKA KANDUNGAN KREATIF"
"";"2541";"KUMPULAN UNIT 2541 PROFESIONAL KESAN VISUAL DAN ANIMASI"
