"";"A";"0164(1)";"Pemprosesan benih untuk pembiakan";"_";"(1)Termasuk:<br>(a) semua aktiviti selepas penuaian bagi tujuan penambahbaikan kualiti benih pembiakan melalui proses mengeluarkan bahan bukan benih, benih yang lebih kecil, rosak kerana serangga atau mekanikal dan benih belum matang termasuk juga mengawal kelembapan benih pada tahap yang selamat untuk disimpan <br>(b) mengering, membersih, menggred dan merawat benih sehingga dipasarkan <br>(c) rawatan benih yang telah dimodifikasikan secara genetik<br> Tidak termasuk: <br>(a) penyediaan produk pertanian oleh pengeluar, lihat kumpulan yang sepadan 011, 012 atau 013 <br>(b) memetik daun tembakau dan pengeringan semula tembakau, lihat 12000 <br>(c) aktiviti pemasaran pedagang yang menerima komisyen dan persatuan koperasi, lihat bahagian 46 <br>(d) pemborong bahan mentah pertanian, lihat kumpulan 462 <br>(e) penanaman benih, lihat kumpulan 011 dan 012 <br>(f) pemprosesan benih untuk mendapatkan minyak, lihat 1040 <br>(g) penyelidikan untuk membangun dan memodifikasi benih dalam bentuk baru, lihat 7210"
"";"A";"01640";"Pemprosesan benih untuk pembiakan(1)";"01640";"(1)Termasuk:<br>(a) semua aktiviti selepas penuaian bagi tujuan penambahbaikan kualiti benih pembiakan melalui proses mengeluarkan bahan bukan benih, benih yang lebih kecil, rosak kerana serangga atau mekanikal dan benih belum matang termasuk juga mengawal kelembapan benih pada tahap yang selamat untuk disimpan <br>(b) mengering, membersih, menggred dan merawat benih sehingga dipasarkan <br>(c) rawatan benih yang telah dimodifikasikan secara genetik<br> Tidak termasuk: <br>(a) penyediaan produk pertanian oleh pengeluar, lihat kumpulan yang sepadan 011, 012 atau 013 <br>(b) memetik daun tembakau dan pengeringan semula tembakau, lihat 12000 <br>(c) aktiviti pemasaran pedagang yang menerima komisyen dan persatuan koperasi, lihat bahagian 46 <br>(d) pemborong bahan mentah pertanian, lihat kumpulan 462 <br>(e) penanaman benih, lihat kumpulan 011 dan 012 <br>(f) pemprosesan benih untuk mendapatkan minyak, lihat 1040 <br>(g) penyelidikan untuk membangun dan memodifikasi benih dalam bentuk baru, lihat 7210"
"";"A";"01";"BAHAGIAN 01 : PENGELUARAN TANAMAN DAN TERNAKAN, PEMBURUAN DAN AKTIVITI PERKHIDMATAN BERKAITAN";"_";"_"
"";"A";"017";"Kumpulan 017 : Pemburuan, penjeratan dan aktiviti perkhidmatan berkaitan";"_";"_"
"";"A";"0170(1)";"Pemburuan, penjeratan dan aktiviti perkhidmatan berkaitan";"_";"(1)Termasuk: pengeluaran kulit daripada pemburuan dan penjeratan haiwan <br>Tidak termasuk: <br>(a) pengeluaran kulit berbulu, kulit burung atau reptilia dari operasi ladang ternakan, lihat 01492 <br>(b) operasi pemeliharaan haiwan untuk sukan di ladang ternakan, lihat 0149 <br>(c) penangkapan ikan paus, lihat 0311 <br>(d) pengeluaran kulit daripada rumah penyembelihan, lihat 1010 <br>(e) pemburuan untuk aktiviti sukan atau rekreasi dan aktiviti perkhidmatan berkaitan, lihat 93199 <br>(f) aktiviti perkhidmatan untuk mempromosi pemburuan dan penjeratan haiwan, lihat 94990"
"";"A";"01701";"Pemburuan dan penjeratan haiwan secara komersial(1)";"01701";"(1)Termasuk: pengeluaran kulit daripada pemburuan dan penjeratan haiwan <br>Tidak termasuk: <br>(a) pengeluaran kulit berbulu, kulit burung atau reptilia dari operasi ladang ternakan, lihat 01492 <br>(b) operasi pemeliharaan haiwan untuk sukan di ladang ternakan, lihat 0149 <br>(c) penangkapan ikan paus, lihat 0311 <br>(d) pengeluaran kulit daripada rumah penyembelihan, lihat 1010 <br>(e) pemburuan untuk aktiviti sukan atau rekreasi dan aktiviti perkhidmatan berkaitan, lihat 93199 <br>(f) aktiviti perkhidmatan untuk mempromosi pemburuan dan penjeratan haiwan, lihat 94990"
"";"A";"01702";"Penangkapan haiwan liar (hidup atau mati)(2)";"01702";"(2)Termasuk: penangkapan haiwan liar (hidup atau mati) untuk makanan, bulu, kulit, untuk kawalan populasi haiwan atau digunakan dalam penyelidikan, di zoo atau haiwan peliharaan"
"";"A";"_";"_";"_";"_"